{
  "schema_version": 3,
  "change_ticket": "CHG-REPLACE-WITH-APPROVED-ID",
  "not_before_utc": "2030-01-01T00:00:00Z",
  "expires_at_utc": "2030-01-01T00:05:00Z",
  "execution_nonce": "00000000000000000000000000000000",
  "target": {
    "connect_host": "replace-with-approved-isolated-host.example.test",
    "connect_port": 3306,
    "server_uuid": "00000000-0000-0000-0000-000000000000",
    "server_hostname": "replace-with-approved-server-hostname",
    "schema": "replace_with_schema"
  },
  "a2_recovery_point": {
    "reference": "A2-REPLACE-WITH-APPROVED-RECOVERY-POINT",
    "recovery_point_sha256": "0000000000000000000000000000000000000000000000000000000000000000",
    "proof_id": "00000000-0000-0000-0000-000000000000",
    "proof_sha256": "0000000000000000000000000000000000000000000000000000000000000000"
  },
  "approval_receipt": {
    "receipt_id": "00000000-0000-0000-0000-000000000000"
  },
  "receipt_claim_helper": {
    "path": "/usr/local/libexec/bank-controlled-sql-receipt-claim-helper",
    "sha256": "0000000000000000000000000000000000000000000000000000000000000000"
  },
  "sql_sha256": {
    "docs/superpowers/sql/2026-08-11-auth-org-profile-group.sql": "0000000000000000000000000000000000000000000000000000000000000000",
    "docs/superpowers/sql/2026-08-11-screen-scope-map-align.sql": "0000000000000000000000000000000000000000000000000000000000000000",
    "docs/superpowers/sql/2026-08-11-screen-scope-map-seed.sql": "0000000000000000000000000000000000000000000000000000000000000000"
  },
  "artifact_sha256": {
    "runner_shell": {
      "path": "docs/superpowers/scripts/2026-08-12-controlled-sql-batch-runner.sh",
      "sha256": "0000000000000000000000000000000000000000000000000000000000000000"
    },
    "runner_python": {
      "path": "docs/superpowers/scripts/2026-08-12-controlled-sql-batch-runner.py",
      "sha256": "0000000000000000000000000000000000000000000000000000000000000000"
    },
    "root_managed_launcher": {
      "path": "docs/superpowers/scripts/2026-08-12-controlled-sql-root-managed-launcher.py",
      "sha256": "0000000000000000000000000000000000000000000000000000000000000000"
    },
    "systemd_unit_template": {
      "path": "docs/superpowers/scripts/2026-08-12-controlled-sql-batch-runner@.service.template",
      "sha256": "0000000000000000000000000000000000000000000000000000000000000000"
    },
    "preflight_checker_shell": {
      "path": "docs/superpowers/scripts/2026-08-12-verify-sql-target-identity-guard.sh",
      "sha256": "0000000000000000000000000000000000000000000000000000000000000000"
    },
    "preflight_checker_python": {
      "path": "docs/superpowers/scripts/2026-08-12-verify-sql-target-identity-guard.py",
      "sha256": "0000000000000000000000000000000000000000000000000000000000000000"
    },
    "manifest_schema": {
      "path": "docs/superpowers/sql/2026-08-12-controlled-sql-batch-manifest.schema.json",
      "sha256": "0000000000000000000000000000000000000000000000000000000000000000"
    },
    "receipt_claim_schema": {
      "path": "docs/superpowers/sql/2026-08-12-controlled-sql-receipt-claim-token.schema.json",
      "sha256": "0000000000000000000000000000000000000000000000000000000000000000"
    },
    "a2_proof_schema": {
      "path": "docs/superpowers/sql/2026-08-12-controlled-sql-a2-recovery-proof.schema.json",
      "sha256": "0000000000000000000000000000000000000000000000000000000000000000"
    },
    "launcher_proof_schema": {
      "path": "docs/superpowers/sql/2026-08-12-controlled-sql-root-launcher-proof.schema.json",
      "sha256": "0000000000000000000000000000000000000000000000000000000000000000"
    },
    "mysql_release_contract_schema": {
      "path": "docs/superpowers/sql/2026-08-12-controlled-sql-mysql-release-contract.schema.json",
      "sha256": "0000000000000000000000000000000000000000000000000000000000000000"
    },
    "mysql_release_contract": {
      "path": "docs/superpowers/sql/2026-08-12-controlled-sql-mysql-release-contract.json",
      "sha256": "0000000000000000000000000000000000000000000000000000000000000000"
    }
  }
}
